,"Region of York Orthophotography, 2011",2011 - 2012,Ontario Ministry of Natural Resources,Various geospatial formats available.,McMaster Students / Staff / Faculty only. Login required for off-campus access.,"<p><a href=""http://geo.scholarsportal.info/#r/details/_uri@=2420838261"">Access this resource</a> on Scholars Geoportal.</p>","<p>The Region of York Orthophotography 2011 data set consists of digital orthophotography at 15 cm resolution, showing the Region of York plus a 2 km buffer. The imagery was created using a Vexcel digital camera and collected in the spring of 2011 to ensure leaf off, no snow conditions, and was acquired in the spring of 2011 by First Base Solutions.</p> <p><b>Compressed GeoTIFFs:</b> These images are JPEG-compressed GeoTIFFs, and are suitable for analysis in many cases. Should you require uncompressed TIFF files, these may be requested for download by contacting geoportal@scholarsportal.info, and providing your name and institution (ex. University of Guelph). For more information, click <b>Request Uncompressed TIFFs</b> below.</p><p> <u>Please note:</u> Due to the size of these tiles (~500 MB each), please request a portion of the data only. This can be done by including a polygon file of the study area, a description of a desired feature/area (ex. UTM campus), or a screenshot in your e-mail. </p>",,"<p>Ontario Ministry of Natural Resources. <em>Region of York Orthophotography, 2011</em> [digital resource: grid]. Ontario Ministry of Natural Resources, (insert date). Retrieved from http://geo.scholarsportal.info/#r/details/_uri@=2420838261.</p>","<p><a href=""http://geo.scholarsportal.info/#r/details/_uri@=2420838261"">Access this resource</a> on Scholars Geoportal.</p>",Internet,Remote Sensing and Air Photos,Ontario,grid,http://images.scholarsportal.info/gis/thumbnails/OGDE/OGDE_RegionOfYork2011TIFFcomp.png,,,2420838261,,,,,,,
,"Mississauga Colour Digital Orthoimagery, 2018",2018 - 2006,"Transportation and Works Department, City of Mississauga",Various geospatial formats available.,McMaster Students / Staff / Faculty only. Login required for off-campus access.,"<p><a href=""http://geo.scholarsportal.info/#r/details/_uri@=4219465383"">Access this resource</a> on Scholars Geoportal.</p>",<p>The 2018 City of Mississauga digital mapping data contains very detailed topographic and planning information clipped to the City of Mississauga municipal boundary.</p><p>This data set contains the 7 cm resolution TIFF version imagery for the City of Mississauga. </p>,,"<p>Transportation and Works Department, City of Mississauga. <em>Mississauga Colour Digital Orthoimagery, 2018</em> [digital resource: grid]. Transportation and Works Department, City of Mississauga, (insert date). Retrieved from http://geo.scholarsportal.info/#r/details/_uri@=4219465383.</p>","<p><a href=""http://geo.scholarsportal.info/#r/details/_uri@=4219465383"">Access this resource</a> on Scholars Geoportal.</p>",Internet,Remote Sensing and Air Photos,Ontario,grid,http://images.scholarsportal.info/gis/thumbnails/CityOfMississauga/CityOfMississauga_2018TIFF.png,,,4219465383,,,,,,,
,DMTI Satellite StreetView (SSV) - Quebec,2002 - 2015,DMTI Spatial Inc.,Various geospatial formats available.,McMaster Students / Staff / Faculty only. Login required for off-campus access.,"<p><a href=""http://geo.scholarsportal.info/#r/details/_uri@=262040818"">Access this resource</a> on Scholars Geoportal.</p>","<p>DMTI Satellite Streetview is an integrated product containing orthorectified and pansharperned QuickBird Satellite imagery data combined with CanMap streets data. It provides satellite imagery at 60cm resolution along with boundary and point data.</p><p>This series contains imagery and supplementary data for several towns, cities, and locations in Quebec. For each record, images are arranged as one mosaic dataset and each mosaic has a currency date associated with it as part of the file name.</p><p>Supplementary files include mosaic tile layouts, street files, census subdivisions, and additional documentation, and are available from the metadata for each image service.</p>",,"<p>DMTI Spatial Inc. <em>DMTI Satellite StreetView (SSV) - Quebec</em> [digital resource: grid]. DMTI Spatial Inc., (insert date). Retrieved from http://geo.scholarsportal.info/#r/details/_uri@=262040818.</p>","<p><a href=""http://geo.scholarsportal.info/#r/details/_uri@=262040818"">Access this resource</a> on Scholars Geoportal.</p>",Internet,Remote Sensing and Air Photos,Ontario,grid,,,,262040818,,,,,,,
,DMTI Satellite StreetView (SSV) - Saskatchewan,2005 - 2015,DMTI Spatial Inc.,Various geospatial formats available.,McMaster Students / Staff / Faculty only. Login required for off-campus access.,"<p><a href=""http://geo.scholarsportal.info/#r/details/_uri@=1883580936"">Access this resource</a> on Scholars Geoportal.</p>","<p>DMTI Satellite Streetview is an integrated product containing orthorectified and pansharperned QuickBird Satellite imagery data combined with CanMap streets data. It provides satellite imagery at 60cm resolution along with boundary and point data.</p><p>This series contains imagery and supplementary data for several towns, cities, and locations in Saskatchewan. For each record, images are arranged as one mosaic dataset and each mosaic has a currency date associated with it as part of the file name.</p><p>Supplementary files include mosaic tile layouts, street files, census subdivisions, and additional documentation, and are available from the metadata for each image service.</p>",,"<p>DMTI Spatial Inc. <em>DMTI Satellite StreetView (SSV) - Saskatchewan</em> [digital resource: grid]. DMTI Spatial Inc., (insert date). Retrieved from http://geo.scholarsportal.info/#r/details/_uri@=1883580936.</p>","<p><a href=""http://geo.scholarsportal.info/#r/details/_uri@=1883580936"">Access this resource</a> on Scholars Geoportal.</p>",Internet,Remote Sensing and Air Photos,Canada,grid,,,,1883580936,,,,,,,
,Limites législatives des terres autochtones du Canada,2017 - 2008,Ressources naturelles Canada,Various geospatial formats available.,Public,"<p><a href=""http://geo.scholarsportal.info/#r/details/_uri@=997340584"">Access this resource</a> on Scholars Geoportal.</p>","<p>L'emsemble de données des terres autochtones du Canada inclut les limites législatives des réserves indiennes, des terres octroyées par une entente (terres créées en vertu du processus des revendications territoriales globales qui n’ont ou n’auront pas le statut de réserve indienne tel que défini dans la Loi sur les Indiens) et des terres indiennes. Il comprend notamment les terres suivantes:</p><p>1) Les réserves indiennes lesquelles incluent:</p><p><li>1.1) les terres cédées ou une réserve au sens de la Loi sur les Indiens (cette définition exclut les établissements indiens et les communautés indiennes); et</li></p><p><li> 1.2) les terres secheltes au sens de la Loi sur l’autonomie gouvernementale de la bande indienne sechelte, chapitre 27 des Statuts du Canada, 1986; </li></p><p>2) Les terres correspondant aux règlements de revendications territoriales lesquelles incluent:</p><p><li> 2.1) les terres de catégorie IA ou IA-N, au sens de la Loi sur les Cris et les Naskapis du Québec, chapitre 18 des Statuts du Canada de 1984 (les terres de catégorie 1B et de catégorie II sont exclues de cette définition); </li></p><p><li> 2.2) les terres visées par le règlement de revendication territoriale telles que définies dans la Loi sur l’autonomie gouvernementale des premières nations du Yukon et des terres dont le droit de propriété est transféré à la première nation ou lui est reconnu en vertu de l’article 21 de cette loi (le service comprend uniquement les terres visées par le règlement des revendications territoriales des premières nations du Yukon qui ont fait l’objet d’un arpentage et dont le plan d’arpentage a été déposé); </li></p><p><li> 2.3) les terres inuites au sens de l’Accord entre les Inuit de la région du Nunavut et Sa Majesté la Reine du Chef du Canada mise en vigueur et déclarée valide par la Loi concernant l’Accord sur les revendications territoriales du Nunavut (ceci comprend toutes les parcelles identifiées dans l’Accord, qu’elles aient été l’objet d’un arpentage officiel ou non (ceci comprend les îles)); </li></p><p><li> 2.4) les terres des Gwich’in au sens de l’Entente sur la revendication territoriale globale des Gwich’in mise en vigueur et déclarée valide par la Loi sur le règlement de la revendication territoriale des Gwich’in; </li></p><p><li> 2.5) les terres inuvialuites au sens de la Loi sur le règlement des revendications des Inuvialuit de la région ouest de l’Arctique;</li></p><p><li> 2.6) les terres du Sahtu au sens de l’Entente sur les revendications territoriales globales des Dénés et Métis du Sahtu mise en vigueur et déclarée valide par la Loi sur le règlement de la revendication territoriale des Dénés et Métis du Sahtu; et</li></p><p><li> 2.7) les terres du peuple tlicho, au sens de l’Accord des Tlicho mise en vigueur et déclarée valide par la Loi sur les revendications territoriales et l’autonomie gouvernementale du peuple tlicho; </li></p><p>3) Les terres indiennes qui comprennent :</p><p><li> 3.1) les terres dans le territoire provisoire des Mohawks de Kanesatake, telles que définies dans la Loi sur le gouvernement du territoire provisoire de Kanesatake, autres que les terres connues comme la réserve Doncaster nº 17.</li></p>",,"<p>Ressources naturelles Canada. <em>Limites législatives des terres autochtones du Canada</em> [digital resource: vector]. Ressources naturelles Canada, (insert date). Retrieved from http://geo.scholarsportal.info/#r/details/_uri@=997340584.</p>","<p><a href=""http://geo.scholarsportal.info/#r/details/_uri@=997340584"">Access this resource</a> on Scholars Geoportal.</p>",Internet,Boundaries,Canada,vector,http://images.scholarsportal.info/gis/thumbnails/OpenContent/OpenContent_NRCan_AboriginalLands_2018_Fra.png,,,997340584,,,,,,,
,Central Ontario Orthophotography Project (COOP) 2016 Digital Elevation Model,2017 - 2010,Ontario Ministry of Natural Resources,Various geospatial formats available.,Public,"<p><a href=""http://geo.scholarsportal.info/#r/details/_uri@=2655731351"">Access this resource</a> on Scholars Geoportal.</p>","The Central Ontario Orthophotography Project (COOP) 2016 Digital Elevation Model (DEM) is a 2m raster elevation product that represents a generalized representation of both surface and ground features. The product was generated by an imagery contractor for the purpose of ortho-rectifying the COOP 2016 orthophotography collected between May 6th and June 10th of 2016. The DEM data is available in the form of 1km x 1km non-overlapping tiles by project area. For more detailed information about this dataset, refer to the associated User Guide.",,"<p>Ontario Ministry of Natural Resources. <em>Central Ontario Orthophotography Project (COOP) 2016 Digital Elevation Model</em> [digital resource: grid]. Ontario Ministry of Natural Resources, (insert date). Retrieved from http://geo.scholarsportal.info/#r/details/_uri@=2655731351.</p>","<p><a href=""http://geo.scholarsportal.info/#r/details/_uri@=2655731351"">Access this resource</a> on Scholars Geoportal.</p>",Internet,Remote Sensing and Air Photos,Ontario,grid,http://images.scholarsportal.info/gis/thumbnails/OpenContent/OpenContent_LIO_DEM_COOP2016.png,,,2655731351,,,,,,,
,London Relief Data - Contours and Spot Heights (3D),2018 - 2019,City of London,Various geospatial formats available.,McMaster Students / Staff / Faculty only. Login required for off-campus access.,"<p><a href=""http://geo.scholarsportal.info/#r/details/_uri@=131183501"">Access this resource</a> on Scholars Geoportal.</p>","<p>The City of London Topographic Map contains very detailed topographic and planning information, clipped to the municipal boundary of the city of London, Ontario. </p><p> This data set includes a 3D representation of spot height elevations and contour lines.</p>",,"<p>City of London. <em>London Relief Data - Contours and Spot Heights (3D)</em> [digital resource: vector]. City of London, (insert date). Retrieved from http://geo.scholarsportal.info/#r/details/_uri@=131183501.</p>","<p><a href=""http://geo.scholarsportal.info/#r/details/_uri@=131183501"">Access this resource</a> on Scholars Geoportal.</p>",Internet,Topography,Ontario,vector,,,,131183501,,,,,,,
,Southwestern Ontario Orthophotography Project (SWOOP) 2015 Classified LAS,2016 - 2005,Ontario Ministry of Natural Resources,Various geospatial formats available.,Public,"<p><a href=""http://geo.scholarsportal.info/#r/details/_uri@=884057598"">Access this resource</a> on Scholars Geoportal.</p>","<p>Southwestern Ontario Orthophotography Project (SWOOP) 2015 Classified LAS was generated by Mapping and Geomatics Services Section (MGSS). </p><p>MGSS staff worked with the raw point cloud LAS data derived from image correlation in order to create a SWOOP 2015 Classified LAS.</p> <p>In total, SWOOP 2015 Classified LAS contains 44,629 non-overlapping tiles (1km x 1km) of classified point cloud data in LAS format covering Southwestern Ontario.</p><p>The Classified LAS is available for download through the use of this index service. Data are available as zlas format for Southwestern Ontario.</p>",,"<p>Ontario Ministry of Natural Resources. <em>Southwestern Ontario Orthophotography Project (SWOOP) 2015 Classified LAS</em> [digital resource: grid]. Ontario Ministry of Natural Resources, (insert date). Retrieved from http://geo.scholarsportal.info/#r/details/_uri@=884057598.</p>","<p><a href=""http://geo.scholarsportal.info/#r/details/_uri@=884057598"">Access this resource</a> on Scholars Geoportal.</p>",Internet,Remote Sensing and Air Photos,Ontario,grid,http://images.scholarsportal.info/gis/thumbnails/OpenContent/OpenContent_LIO_ClassLAS_SWOOP2015zlasIndex_vt.png,,,884057598,,,,,,,
,Central Ontario Orthophotography Project (COOP) 2016 Classified LAS,2017 - 2011,Ontario Ministry of Natural Resources,Various geospatial formats available.,Public,"<p><a href=""http://geo.scholarsportal.info/#r/details/_uri@=3007330067"">Access this resource</a> on Scholars Geoportal.</p>","<p>Central Ontario Orthophotography Project (COOP) 2016 Classified LAS was generated by Mapping and Geomatics Services Section (MGSS). </p><p>MGSS staff worked with the raw point cloud LAS data derived from image correlation in order to create a COOP 2016 Classified LAS.</p> <p>In total, COOP 2016 Classified LAS contains 53,729 non-overlapping tiles (1km x 1km) of classified point cloud data in LAS format covering Central Ontario.</p><p>The Classified LAS is available for download through the use of this index service. Data are available as zlas format.</p>",,"<p>Ontario Ministry of Natural Resources. <em>Central Ontario Orthophotography Project (COOP) 2016 Classified LAS</em> [digital resource: grid]. Ontario Ministry of Natural Resources, (insert date). Retrieved from http://geo.scholarsportal.info/#r/details/_uri@=3007330067.</p>","<p><a href=""http://geo.scholarsportal.info/#r/details/_uri@=3007330067"">Access this resource</a> on Scholars Geoportal.</p>",Internet,Remote Sensing and Air Photos,Ontario,grid,http://images.scholarsportal.info/gis/thumbnails/OpenContent/OpenContent_LIO_ClassLAS_COOP2016lazIndex_vt.png,,,3007330067,,,,,,,
