Nid,Title,Year,Author,Format,Who Can Use This Data,URL,Abstract,Metadata,How to Cite This,Scholars Geoportal URL,Geospatial Availability,Geospatial Subjects New,Geospatial Geography,Geospatial Formats,Filepath,field_geospatial_image_alt,field_geospatial_image_title,SGP_id,Projection,Datum,Entry Date,File Location,File Size
48793,Lidar Classified Point Cloud (2016-17),2017 - 2007,"Ontario Ministry of Agriculture, Food and Rural Affairs",Various geospatial formats available.,Public,"<p><a href=""http://geo.scholarsportal.info/#r/details/_uri@=""19c7687a-5df3-4253-97ab-0dfbedd85ec4"">Access this resource</a> on Scholars Geoportal.</p>","The Lidar Classified Point Cloud (2016-17) consists of points containing elevation and intensity information derived from returns collected by an airborne lidar sensor.
The lidar point cloud covers selected regional areas in Southern Ontario and portions of Northern Ontario.  This data is the output of the first year of a two year data collection project.  Data collection occurred during the fall of 2016 and spring of 2017.  Data will be updated to include, Lake Erie and remaining Peterborough and Cochrane project areas in the first half of 2018. 
A classification scheme has been applied to the point cloud by the contractor to identify the type of target from which the return is reflected, and differentiates between bare-earth terrain points, water, high and low noise returns.  The classified point cloud is organized into non-overlapping 1km x 1km tiles.
For more detailed information about this dataset, including information about interpreting the index for placement of data orders, please refer to the associated User Guide.",,,"<p><a href=""http://geo.scholarsportal.info/#r/details/_uri@=""19c7687a-5df3-4253-97ab-0dfbedd85ec4"">Access this resource</a> on Scholars Geoportal.</p>",Internet,Location, ,,https://www.javacoeapp.lrc.gov.on.ca/geonetwork/srv/en/resources.get.thumbnail?id=15139&access=public&fname=LidarPointCloud_Thumbnail.png,,,19c7687a-5df3-4253-97ab-0dfbedd85ec4,,,,,,,
48670,Lidar Raw Point Cloud (2016-17),2017 - 2015,"Ontario Ministry of Agriculture, Food and Rural Affairs",Various geospatial formats available.,Public,"<p><a href=""http://geo.scholarsportal.info/#r/details/_uri@=""f5b4ccf2-5aaf-4ec5-bfb3-98f178a11041"">Access this resource</a> on Scholars Geoportal.</p>","The Lidar Raw Point Cloud (2016-17) consists of points containing elevation and intensity information derived from returns collected by an airborne lidar sensor.
The lidar point cloud covers selected regional areas in Southern Ontario and portions of Northern Ontario.  This data is the output of the first year of a two year data collection project.  Data collection occurred during the fall of 2016 and spring of 2017.  Data will be updated to include, Lake Erie and remaining Peterborough and Cochrane project areas in the first half of 2018. 
This is the raw point cloud delivered by the contractor which was used as a source for generating the classified point cloud, and DTM.  Both of these products are available separately.  The Raw Point Cloud data is organized by lift and overlapping flight lines within the lifts.
For more detailed information about this dataset, including information about interpreting the index for placement of data orders, please refer to the associated User Guide.",,,"<p><a href=""http://geo.scholarsportal.info/#r/details/_uri@=""f5b4ccf2-5aaf-4ec5-bfb3-98f178a11041"">Access this resource</a> on Scholars Geoportal.</p>",Internet,Location, ,,https://www.javacoeapp.lrc.gov.on.ca/geonetwork/srv/en/resources.get.thumbnail?id=15137&access=public&fname=LidarPointCloudRaw_Thumbnail.png,,,f5b4ccf2-5aaf-4ec5-bfb3-98f178a11041,,,,,,,
48688,Southwestern Ontario Orthophotography Project -  (SWOOP) 2015 Classified LAS,2017 - 2012,Ontario Ministry of Natural Resources and Forestry – Provincial Mapping Unit,Various geospatial formats available.,Public,"<p><a href=""http://geo.scholarsportal.info/#r/details/_uri@=""64d2e1be-453e-4061-aa5a-ecd9af96576d"">Access this resource</a> on Scholars Geoportal.</p>","Southwestern Ontario Orthophotography Project (SWOOP) 2015 Classified LAS was generated by Mapping and Geomatics Services Section (MGSS). MGSS staff worked with the raw point cloud LAS data derived from image correlation in order to create a SWOOP 2015 Classified LAS. In total, SWOOP 2015 Classified LAS contains 44,629 non-overlapping tiles (1km x 1km) of classified point cloud data in LAS format covering Southwestern Ontario.",,,"<p><a href=""http://geo.scholarsportal.info/#r/details/_uri@=""64d2e1be-453e-4061-aa5a-ecd9af96576d"">Access this resource</a> on Scholars Geoportal.</p>",Internet,Remote Sensing and Air Photos, ,,https://www.javacoeapp.lrc.gov.on.ca/geonetwork/srv/en/resources.get.thumbnail?id=14697&access=public&fname=SWOOP2015ClassLAS.png,,,64d2e1be-453e-4061-aa5a-ecd9af96576d,,,,,,,
