Nid,Title,Year,Author,Format,Who Can Use This Data,URL,Abstract,Metadata,How to Cite This,Scholars Geoportal URL,Geospatial Availability,Geospatial Subjects New,Geospatial Geography,Geospatial Formats,Filepath,field_geospatial_image_alt,field_geospatial_image_title,SGP_id,Projection,Datum,Entry Date,File Location,File Size
,Greater Toronto Area (GTA) Orthophotography - 1995,1995 - 2015,Ontario Ministry of Natural Resources,Various geospatial formats available.,McMaster Students / Staff / Faculty only. Login required for off-campus access.,"<p><a href=""http://geo.scholarsportal.info/#r/details/_uri@=3277363296"">Access this resource</a> on Scholars Geoportal.</p>","<p>Greater Toronto Area (GTA) Orthophotography 1995 consists of 5km x 2.8 km tiles of orthorectified colour imagery for the Greater Toronto Area, 100cm resolution, covering an area of 6,289 sq. km.</p> <p>This colour aerial photography was captured on September 15, 28, and 29, 1995, using a Zeiss Jena LMK15 aerial camera equipped with a (152mm) focal length lens mounted in a Piper Aztec F aircraft. The altitude of the aircraft, 15,000 feet above mean ground, provided photography at a nominal scale of 1:30000. Originally captured on film, the imagery was converted digitally and orthorectified. The final product has the same accuracy as a 1:20000 map.</p><p><b>Note:</b>This imagery is spatially defined in NAD 27.</p>",,"<p>Ontario Ministry of Natural Resources. <em>Greater Toronto Area (GTA) Orthophotography - 1995</em> [digital resource: grid]. Ontario Ministry of Natural Resources, (insert date). Retrieved from http://geo.scholarsportal.info/#r/details/_uri@=3277363296.</p>","<p><a href=""http://geo.scholarsportal.info/#r/details/_uri@=3277363296"">Access this resource</a> on Scholars Geoportal.</p>",Internet,Remote Sensing and Air Photos,Ontario,grid,http://images.scholarsportal.info/gis/thumbnails/OGDE/OGDE_GTA1995TIFF.png,,,3277363296,,,,,,,
,London Topographic Map - PDF,2018 - 2019,City of London,Various geospatial formats available.,McMaster Students / Staff / Faculty only. Login required for off-campus access.,"<p><a href=""http://geo.scholarsportal.info/#r/details/_uri@=3623736449"">Access this resource</a> on Scholars Geoportal.</p>","<p>The City of London Topographic Map contains very detailed topographic information in PDF format.</p><p> This data set is clipped to the municipal boundary of the city of London, Ontario.</p>",,"<p>City of London. <em>London Topographic Map - PDF</em> [digital resource: vector]. City of London, (insert date). Retrieved from http://geo.scholarsportal.info/#r/details/_uri@=3623736449.</p>","<p><a href=""http://geo.scholarsportal.info/#r/details/_uri@=3623736449"">Access this resource</a> on Scholars Geoportal.</p>",Internet,Topography,Ontario,vector,,,,3623736449,,,,,,,
,Digital Raster Acquisition Project Eastern Ontario (DRAPE) 2014 Digital Elevation Model,2015 - 2014,Ontario Ministry of Natural Resources,Various geospatial formats available.,Public,"<p><a href=""http://geo.scholarsportal.info/#r/details/_uri@=1863583366"">Access this resource</a> on Scholars Geoportal.</p>","<p>The DRAPE 2014 DEM is a 2m raster elevation product that represents a generalized representation of both surface and ground features. The product was generated by an imagery contractor for the purpose of ortho-rectifying the DRAPE 2014 ortho-photography. Digital Raster Acquisition Project Eastern Ontario (DRAPE) ortho-photography was collected through a collaborative funding partnership for eastern Ontario. Contributing organizations include the Ontario Government, municipalities, Conservation Authorities, the private sector and the Federal Government.</p> <p>DRAPE 2014 DEM contains 37,290 non-overlapping tiles (1km x 1km) covering the Counties of Frontenac, Lanark, Lennox and Addington, Renfrew, the United Counties of Leeds and Grenville, Prescott and Russell, Stormont, Dundas and Glengarry, the Towns of Prescott, Gananoque and Smiths Falls, the Township of South Algonquin and the Cities of Cornwall, Brockville, Kingston and Ottawa.</p>",,"<p>Ontario Ministry of Natural Resources. <em>Digital Raster Acquisition Project Eastern Ontario (DRAPE) 2014 Digital Elevation Model</em> [digital resource: grid]. Ontario Ministry of Natural Resources, (insert date). Retrieved from http://geo.scholarsportal.info/#r/details/_uri@=1863583366.</p>","<p><a href=""http://geo.scholarsportal.info/#r/details/_uri@=1863583366"">Access this resource</a> on Scholars Geoportal.</p>",Internet,Topography,Ontario,grid,http://images.scholarsportal.info/gis/thumbnails/OpenContent/OpenContent_LIO_DEM_DRAPE2014.png,,,1863583366,,,,,,,
,"Region of Niagara Orthophotography, 2006",2006 - 2007,Ontario Ministry of Natural Resources,Various geospatial formats available.,McMaster Students / Staff / Faculty only. Login required for off-campus access.,"<p><a href=""http://geo.scholarsportal.info/#r/details/_uri@=3354364774"">Access this resource</a> on Scholars Geoportal.</p>","<p>The Region of Niagara Orthophotography 2006 data set consists of 20 cm digital orthophotography covering the Region of Niagara. The imagery was collected by First Base Solutions.</p> <p><b>Compressed GeoTIFFs:</b> These images are JPEG-compressed GeoTIFFs, and are suitable for analysis in many cases. Should you require uncompressed TIFF files, these may be requested for download by contacting geoportal@scholarsportal.info, and providing your name and institution (ex. University of Guelph). For more information, click <b>Request Uncompressed TIFFs</b> below.</p><p> <u>Please note:</u> Due to the size of these tiles (~500 MB each), please request a portion of the data only. This can be done by including a polygon file of the study area, a description of a desired feature/area (ex. UTM campus), or a screenshot in your e-mail. </p>",,"<p>Ontario Ministry of Natural Resources. <em>Region of Niagara Orthophotography, 2006</em> [digital resource: grid]. Ontario Ministry of Natural Resources, (insert date). Retrieved from http://geo.scholarsportal.info/#r/details/_uri@=3354364774.</p>","<p><a href=""http://geo.scholarsportal.info/#r/details/_uri@=3354364774"">Access this resource</a> on Scholars Geoportal.</p>",Internet,Remote Sensing and Air Photos,Ontario,grid,http://images.scholarsportal.info/gis/thumbnails/OGDE/OGDE_Niagara2006TIFFcomp.png,,,3354364774,,,,,,,
,Mississauga Legend,2018 - 2014,"Transportation and Works Department, City of Mississauga",Various geospatial formats available.,McMaster Students / Staff / Faculty only. Login required for off-campus access.,"<p><a href=""http://geo.scholarsportal.info/#r/details/_uri@=3344686804"">Access this resource</a> on Scholars Geoportal.</p>","<p>The 2018 City of Mississauga digital mapping data contains very detailed topographic and planning information clipped to the City of Mississauga municipal boundary based on a scale of 1:2,000.</p><p>This data set contains a legend of street information for the City of Mississauga, Ontario. </p>",,"<p>Transportation and Works Department, City of Mississauga. <em>Mississauga Legend</em> [digital resource: vector]. Transportation and Works Department, City of Mississauga, (insert date). Retrieved from http://geo.scholarsportal.info/#r/details/_uri@=3344686804.</p>","<p><a href=""http://geo.scholarsportal.info/#r/details/_uri@=3344686804"">Access this resource</a> on Scholars Geoportal.</p>",Internet,Transportation,Ontario,vector,,,,3344686804,,,,,,,
,South Central Ontario Orthophotography Project (SCOOP) 2013 Digital Elevation Model,2015 - 2009,Ontario Ministry of Natural Resources,Various geospatial formats available.,Public,"<p><a href=""http://geo.scholarsportal.info/#r/details/_uri@=4271578743"">Access this resource</a> on Scholars Geoportal.</p>","<p>The SCOOP 2013 DEM is a 2m raster elevation product that represents a generalized representation of both surface and ground features. SCOOP 2013 digital imagery was collected for areas in South Central Ontario between April 26th and May 7th 2013.</p> <p>The SCOOP 2013 DEM product contains 35,923 tiles (1km x 1km), and the acquired digital imagery encompasses an area of approximately 35,762 square kilometers. The resulting Digital Elevation Model (DEM) has a resolution of 2m.</p><p>The DEM product covers South Central Ontario including Peterborough, Haliburton, Muskoka, Simcoe and surrounding areas.</p>",,"<p>Ontario Ministry of Natural Resources. <em>South Central Ontario Orthophotography Project (SCOOP) 2013 Digital Elevation Model</em> [digital resource: grid]. Ontario Ministry of Natural Resources, (insert date). Retrieved from http://geo.scholarsportal.info/#r/details/_uri@=4271578743.</p>","<p><a href=""http://geo.scholarsportal.info/#r/details/_uri@=4271578743"">Access this resource</a> on Scholars Geoportal.</p>",Internet,Remote Sensing and Air Photos,Ontario,grid,http://images.scholarsportal.info/gis/thumbnails/OpenContent/OpenContent_LIO_DEM_SCOOP2013.png,,,4271578743,,,,,,,
,London Water,2019 - 2014,City of London,Various geospatial formats available.,McMaster Students / Staff / Faculty only. Login required for off-campus access.,"<p><a href=""http://geo.scholarsportal.info/#r/details/_uri@=2141242874"">Access this resource</a> on Scholars Geoportal.</p>","<p>The 2018 City of London digital mapping vector data contains very detailed topographic and planning information clipped to the City of London municipal boundary based on a scale of 1:2,000.</p><p>This data set contains the geographic location of water in the City of London, Ontario.</p>",,"<p>City of London. <em>London Water</em> [digital resource: vector]. City of London, (insert date). Retrieved from http://geo.scholarsportal.info/#r/details/_uri@=2141242874.</p>","<p><a href=""http://geo.scholarsportal.info/#r/details/_uri@=2141242874"">Access this resource</a> on Scholars Geoportal.</p>",Internet,Water Resources,Ontario,vector,http://images.scholarsportal.info/gis/thumbnails/Western/Western_CityOfLondon_2018_Water.png,,,2141242874,,,,,,,
,South Central Ontario Orthophotography Project (SCOOP) 2013 [revised],2013 - 2015,Ontario Ministry of Natural Resources,Various geospatial formats available.,McMaster Students / Staff / Faculty only. Login required for off-campus access.,"<p><a href=""http://geo.scholarsportal.info/#r/details/_uri@=3594236861"">Access this resource</a> on Scholars Geoportal.</p>","<p>SCOOP digital imagery was collected with sensor Leica geosystems ADS80 SH82 for areas of Ontario between April 26th and May 7th 2013. </p><p>The project encompassed an area of approximately 35,762 square kilometers, covering parts of South Central Ontario including Peterborough, Haliburton, Muskoka, Simcoe and surrounding areas. </p> <p>A Leica ADS80 SH82 Digital Camera system including an inertial measuring unit (IMU) and a dual frequency airborne GPS receiver was used for the digital image acquisition. Imagery acquisition was performed at 1,920m AMT (above mean terrain) to produce 20cm GSD RGBNiR orthorectified imagery and related products. Ground control survey was also collected by Fugro. </p> <p>This dataset represents a revised, colour-balanced version, to facilitate a seamless coverage over the entire collection of images. The original version is available in both JP2 and TIFF format here: http://geo2.scholarsportal.info/#r/details/_uri@=3516388189</p><p><b>Compressed GeoTIFFs:</b> These images are JPEG-compressed GeoTIFFs, and are suitable for analysis in many cases. Should you require uncompressed TIFF files, these may be requested for download by contacting geoportal@scholarsportal.info, and providing your name and institution (ex. University of Guelph). For more information, click <b>Request Uncompressed TIFFs</b> below.</p><p> <u>Please note:</u> Due to the size of these tiles (~500 MB each), please request a portion of the data only. This can be done by including a polygon file of the study area, a description of a desired feature/area (ex. UTM campus), or a screenshot in your e-mail. </p>",,"<p>Ontario Ministry of Natural Resources. <em>South Central Ontario Orthophotography Project (SCOOP) 2013 [revised]</em> [digital resource: grid]. Ontario Ministry of Natural Resources, (insert date). Retrieved from http://geo.scholarsportal.info/#r/details/_uri@=3594236861.</p>","<p><a href=""http://geo.scholarsportal.info/#r/details/_uri@=3594236861"">Access this resource</a> on Scholars Geoportal.</p>",Internet,Remote Sensing and Air Photos,Ontario,grid,http://images.scholarsportal.info/gis/thumbnails/OGDE/OGDE_SCOOP2013TIFFv2comp.png,,,3594236861,,,,,,,
,London Digital Elevation Model,2018 - 2019,City of London,Various geospatial formats available.,McMaster Students / Staff / Faculty only. Login required for off-campus access.,"<p><a href=""http://geo.scholarsportal.info/#r/details/_uri@=89249774"">Access this resource</a> on Scholars Geoportal.</p>","<p>The City of London Digital Elevation model is a 3-dimensional raster data set which captures terrain elevations.</p><p> This data set covers the entirety of the city of London, Ontario.</p>",,"<p>City of London. <em>London Digital Elevation Model</em> [digital resource: vector]. City of London, (insert date). Retrieved from http://geo.scholarsportal.info/#r/details/_uri@=89249774.</p>","<p><a href=""http://geo.scholarsportal.info/#r/details/_uri@=89249774"">Access this resource</a> on Scholars Geoportal.</p>",Internet,Topography,Ontario,vector,,,,89249774,,,,,,,
,London Buildings,2019 - 2018,City of London,Various geospatial formats available.,McMaster Students / Staff / Faculty only. Login required for off-campus access.,"<p><a href=""http://geo.scholarsportal.info/#r/details/_uri@=809110714"">Access this resource</a> on Scholars Geoportal.</p>","<p>The 2018 City of London digital mapping vector data contains very detailed topographic and planning information clipped to the City of London municipal boundary based on a scale of 1:2,000.</p><p>This data set contains the geographic location of buildings in the City of London, Ontario.</p>",,"<p>City of London. <em>London Buildings</em> [digital resource: vector]. City of London, (insert date). Retrieved from http://geo.scholarsportal.info/#r/details/_uri@=809110714.</p>","<p><a href=""http://geo.scholarsportal.info/#r/details/_uri@=809110714"">Access this resource</a> on Scholars Geoportal.</p>",Internet,Human Environment,Ontario,vector,http://images.scholarsportal.info/gis/thumbnails/Western/Western_CityOfLondon_2018_Buildings.png,,,809110714,,,,,,,
,Aboriginal Lands of Canada Legislative Boundaries,2017 - 1998,Natural Resources Canada,Various geospatial formats available.,Public,"<p><a href=""http://geo.scholarsportal.info/#r/details/_uri@=2071748791"">Access this resource</a> on Scholars Geoportal.</p>","<p>The Aboriginal Lands of Canada Legislative Boundaries dataset includes legislative boundaries of Indian Reserves, Land Claim Settlement Lands (lands created under Comprehensive Land Claims Process that do not or will not have Indian Reserve status under the Indian Act) and Indian Lands. More specifically it includes the following lands: </p><p>1) Indian Reserves that include:</p><p><li>1.1) surrendered lands or a reserve, as defined in the Indian Act (this definition excludes Indian Settlements and Indian Communities); and </li></p><p><li> 1.2) Sechelt lands, as defined in the Sechelt Indian Band Self-Government Act, chapter 27 of the Statutes of Canada, 1986; </li></p><p>2) Land Claim Settlement Lands that include: </p><p><li> 2.1) Category IA land or Category IA-N land, as defined in the Cree-Naskapi (of Quebec) Act, chapter 18 of the Statutes of Canada, 1984 (category 1B and category II Lands are excluded from this definition); </li></p><p><li> 2.2) Settlement land, as defined in the Yukon First Nations Self-Government Act, and lands in which an interest is transferred or recognized under section 21 of that Act (only Yukon First Nations Settlement Lands, which were surveyed and the survey plan recorded, are included in the map service); </li></p><p><li> 2.3) Inuit Owned Lands as defined in the Agreement between the Inuit of the Nunavut Settlement Area and Her Majesty the Queen in Right of Canada given effect and declared valid by the Nunavut Land Claims Agreement Act (it includes all parcels that have been surveyed and those that do not require a survey (this includes the islands)); </li></p><p><li> 2.4) Gwich’in Lands as defined in the Gwich’in Comprehensive Land Claim Agreement, given effect and declared valid by the Gwich’in Land Claim Settlement Act;</li></p><p><li> 2.5) Inuvialuit Lands as defined in the Western Arctic (Inuvialuit) Claims Settlement Act; </li></p><p><li> 2.6) Sahtu Lands as defined in The Sahtu Dene and Métis Comprehensive Land Claim Agreement given effect and declared valid by the Sahtu Dene and Métis Land Claim Settlement Act; and </li></p><p><li> 2.7) Tlicho lands, as defined in the Tlicho Agreement, given effect and declared valid by the Tlicho Land Claims and Self-Government Act; </li></p><p>3) Indian Lands that include: </p><p><li> 3.1) Lands in the Kanesatake Mohawk interim land base, as defined in the Kanesatake Mohawk Interim Land Base Governance Act, other than the lands known as Doncaster Reserve No. 17.</li></p>",,"<p>Natural Resources Canada. <em>Aboriginal Lands of Canada Legislative Boundaries</em> [digital resource: vector]. Natural Resources Canada, (insert date). Retrieved from http://geo.scholarsportal.info/#r/details/_uri@=2071748791.</p>","<p><a href=""http://geo.scholarsportal.info/#r/details/_uri@=2071748791"">Access this resource</a> on Scholars Geoportal.</p>",Internet,Boundaries,Canada,vector,http://images.scholarsportal.info/gis/thumbnails/OpenContent/OpenContent_NRCan_AboriginalLands_2018_Eng.png,,,2071748791,,,,,,,
,Mississauga City Mask,2018 - 2003,"Transportation and Works Department, City of Mississauga",Various geospatial formats available.,McMaster Students / Staff / Faculty only. Login required for off-campus access.,"<p><a href=""http://geo.scholarsportal.info/#r/details/_uri@=3205168528"">Access this resource</a> on Scholars Geoportal.</p>","<p>The 2018 City of Mississauga digital mapping data contains very detailed topographic and planning information clipped to the City of Mississauga municipal boundary based on a scale of 1:2,000.</p><p>This data set contains a mask of the City of Mississauga, Ontario. </p>",,"<p>Transportation and Works Department, City of Mississauga. <em>Mississauga City Mask</em> [digital resource: vector]. Transportation and Works Department, City of Mississauga, (insert date). Retrieved from http://geo.scholarsportal.info/#r/details/_uri@=3205168528.</p>","<p><a href=""http://geo.scholarsportal.info/#r/details/_uri@=3205168528"">Access this resource</a> on Scholars Geoportal.</p>",Internet,Boundaries,Ontario,vector,,,,3205168528,,,,,,,
,Mississauga Street Name Listing,2018 - 2003,"Transportation and Works Department, City of Mississauga",Various geospatial formats available.,McMaster Students / Staff / Faculty only. Login required for off-campus access.,"<p><a href=""http://geo.scholarsportal.info/#r/details/_uri@=1758606372"">Access this resource</a> on Scholars Geoportal.</p>","<p>The 2018 City of Mississauga digital mapping data contains very detailed topographic and planning information clipped to the City of Mississauga municipal boundary based on a scale of 1:2,000.</p><p>This data set contains a listing of street names in the City of Mississauga, Ontario. </p>",,"<p>Transportation and Works Department, City of Mississauga. <em>Mississauga Street Name Listing</em> [digital resource: vector]. Transportation and Works Department, City of Mississauga, (insert date). Retrieved from http://geo.scholarsportal.info/#r/details/_uri@=1758606372.</p>","<p><a href=""http://geo.scholarsportal.info/#r/details/_uri@=1758606372"">Access this resource</a> on Scholars Geoportal.</p>",Internet,Transportation,Ontario,vector,,,,1758606372,,,,,,,
,Digital Raster Acquisition Project Eastern Ontario (DRAPE) 2014 Classified LAS,2016 - 2012,Ontario Ministry of Natural Resources,Various geospatial formats available.,Public,"<p><a href=""http://geo.scholarsportal.info/#r/details/_uri@=3469315595"">Access this resource</a> on Scholars Geoportal.</p>","<p>Digital Raster Acquisition Project Eastern Ontario (DRAPE) 2014 Classified LAS was generated by Mapping and Geomatics Services Section (MGSS). </p><p>MGSS staff worked with the raw point cloud LAS data derived from image correlation in order to create a DRAPE 2014 Classified LAS.</p> <p>In total, DRAPE 2014 Classified LAS contains 37,227 non-overlapping tiles (1km x 1km) of classified point cloud data in LAS format covering Eastern Ontario.</p><p>The Classified LAS is available for download through the use of this index service. Data are available as zlas format.</p>",,"<p>Ontario Ministry of Natural Resources. <em>Digital Raster Acquisition Project Eastern Ontario (DRAPE) 2014 Classified LAS</em> [digital resource: grid]. Ontario Ministry of Natural Resources, (insert date). Retrieved from http://geo.scholarsportal.info/#r/details/_uri@=3469315595.</p>","<p><a href=""http://geo.scholarsportal.info/#r/details/_uri@=3469315595"">Access this resource</a> on Scholars Geoportal.</p>",Internet,Remote Sensing and Air Photos,Ontario,grid,http://images.scholarsportal.info/gis/thumbnails/OpenContent/OpenContent_LIO_ClassLAS_DRAPE2014zlasIndex_vt.png,,,3469315595,,,,,,,
,London Topographic Feature Data (2D),2018 - 2019,City of London,Various geospatial formats available.,McMaster Students / Staff / Faculty only. Login required for off-campus access.,"<p><a href=""http://geo.scholarsportal.info/#r/details/_uri@=3667315597"">Access this resource</a> on Scholars Geoportal.</p>","<p>The City of London Topographic Map contains very detailed topographic and planning information, clipped to the municipal boundary of the city of London, Ontario. </p><p> This data set includes features such as hydrography, vegetation, and shoreline.</p>",,"<p>City of London. <em>London Topographic Feature Data (2D)</em> [digital resource: vector]. City of London, (insert date). Retrieved from http://geo.scholarsportal.info/#r/details/_uri@=3667315597.</p>","<p><a href=""http://geo.scholarsportal.info/#r/details/_uri@=3667315597"">Access this resource</a> on Scholars Geoportal.</p>",Internet,Topography,Ontario,vector,,,,3667315597,,,,,,,
,DMTI Satellite StreetView (SSV) - Ontario,2002 - 2012,DMTI Spatial Inc.,Various geospatial formats available.,McMaster Students / Staff / Faculty only. Login required for off-campus access.,"<p><a href=""http://geo.scholarsportal.info/#r/details/_uri@=692798415"">Access this resource</a> on Scholars Geoportal.</p>","<p>DMTI Satellite Streetview is an integrated product containing orthorectified and pansharperned QuickBird Satellite imagery data combined with CanMap streets data. It provides satellite imagery at 60cm resolution along with boundary and point data.</p><p>This series contains imagery and supplementary data for several towns, cities, and locations in Ontario. For each record, images are arranged as one mosaic dataset and each mosaic has a currency date associated with it as part of the file name.</p><p>Supplementary files include mosaic tile layouts, street files, census subdivisions, and additional documentation, and are available from the metadata for each image service.</p>",,"<p>DMTI Spatial Inc. <em>DMTI Satellite StreetView (SSV) - Ontario</em> [digital resource: grid]. DMTI Spatial Inc., (insert date). Retrieved from http://geo.scholarsportal.info/#r/details/_uri@=692798415.</p>","<p><a href=""http://geo.scholarsportal.info/#r/details/_uri@=692798415"">Access this resource</a> on Scholars Geoportal.</p>",Internet,Remote Sensing and Air Photos,Ontario,grid,,,,692798415,,,,,,,
,"Region of Peel Orthophotography, 2011",2011 - 2011,Ontario Ministry of Natural Resources,Various geospatial formats available.,McMaster Students / Staff / Faculty only. Login required for off-campus access.,"<p><a href=""http://geo.scholarsportal.info/#r/details/_uri@=3095982928"">Access this resource</a> on Scholars Geoportal.</p>","<p>The Region of Peel Orthophotography 2011 data set consists of digital orthophotography at 15 cm resolution, showing the Region of Peel. The imagery was created using a Vexcel digital camera and collected in the spring of 2011 to ensure leaf off, no snow conditions, and was acquired in the spring of 2011 by First Base Solutions.</p> <p><b>Compressed GeoTIFFs:</b> These images are JPEG-compressed GeoTIFFs, and are suitable for analysis in many cases. Should you require uncompressed TIFF files, these may be requested for download by contacting geoportal@scholarsportal.info, and providing your name and institution (ex. University of Guelph). For more information, click <b>Request Uncompressed TIFFs</b> below.</p><p> <u>Please note:</u> Due to the size of these tiles (~500 MB each), please request a portion of the data only. This can be done by including a polygon file of the study area, a description of a desired feature/area (ex. UTM campus), or a screenshot in your e-mail. </p>",,"<p>Ontario Ministry of Natural Resources. <em>Region of Peel Orthophotography, 2011</em> [digital resource: grid]. Ontario Ministry of Natural Resources, (insert date). Retrieved from http://geo.scholarsportal.info/#r/details/_uri@=3095982928.</p>","<p><a href=""http://geo.scholarsportal.info/#r/details/_uri@=3095982928"">Access this resource</a> on Scholars Geoportal.</p>",Internet,Remote Sensing and Air Photos,Ontario,grid,http://images.scholarsportal.info/gis/thumbnails/OGDE/OGDE_RegionOfPeel2011TIFFcomp.png,,,3095982928,,,,,,,
